{
  "$schema": "http://json-schema.org/draft-07/schema#",
  "title": "PCP-lite Context Packet Manifest",
  "description": "Schema for machine-readable Context Packets used by Clarity Engine (Stage 0).",
  "type": "object",
  "additionalProperties": false,
  "required": [
    "mission",
    "current_reality",
    "constraints",
    "acceptance",
    "required_artifacts",
    "failure_modes",
    "substage_gate"
  ],
  "properties": {
    "project": {
      "type": "string",
      "description": "Optional project name the packet belongs to."
    },
    "stage": {
      "type": "string",
      "description": "Optional lifecycle stage label (e.g., 'Stage 0')."
    },
    "substage": {
      "type": "string",
      "description": "Optional substage identifier within the lifecycle stage."
    },
    "version": {
      "type": "string",
      "description": "Optional version of the PCP-lite schema/template used to craft the packet."
    },
    "mission": {
      "type": "string",
      "description": "Succinct mission statement for the packet."
    },
    "current_reality": {
      "type": "array",
      "items": {
        "type": "string"
      },
      "minItems": 1,
      "description": "Bullet list of current, factual statements."
    },
    "constraints": {
      "type": "array",
      "items": {
        "type": "string"
      },
      "minItems": 1,
      "description": "Boundary conditions that must hold true."
    },
    "acceptance": {
      "type": "array",
      "items": {
        "type": "string"
      },
      "minItems": 1,
      "description": "Testable definition of done bullets."
    },
    "required_artifacts": {
      "type": "array",
      "items": {
        "type": "string"
      },
      "minItems": 1,
      "description": "Outputs that must be produced for the packet to be complete."
    },
    "failure_modes": {
      "type": "array",
      "items": {
        "type": "string"
      },
      "minItems": 1,
      "description": "Known risks, anti-goals, or explicit non-scope items."
    },
    "substage_gate": {
      "type": "array",
      "items": {
        "type": "string"
      },
      "minItems": 1,
      "description": "Boundaries describing what is in or out of scope for the substage."
    },
    "notes": {
      "type": "array",
      "items": {
        "type": "string"
      },
      "minItems": 1,
      "description": "Optional clarifications, warnings, or caveats."
    },
    "sources_of_truth": {
      "type": "array",
      "items": {
        "type": "string"
      },
      "minItems": 1,
      "description": "Optional links or references that anchor facts and constraints."
    },
    "risk_flags": {
      "type": "array",
      "items": {
        "type": "string",
        "enum": [
          "high_blast_radius",
          "needs_human_signoff",
          "missing_info",
          "network_required",
          "destructive_action",
          "secrets_involved",
          "external_dependency"
        ]
      },
      "description": "Optional flags indicating risk factors. Downstream systems can use these to gate execution or require approval."
    },
    "allowed_actions": {
      "type": "array",
      "items": {
        "type": "string",
        "enum": [
          "git_read",
          "git_write",
          "filesystem_read",
          "filesystem_write",
          "http_read",
          "http_write",
          "docker",
          "shell_exec",
          "secrets_read",
          "database_read",
          "database_write"
        ]
      },
      "description": "Optional list of actions the executing agent is permitted to perform. Agents should validate against this before acting."
    },
    "evidence_requirements": {
      "type": "array",
      "items": {
        "type": "string",
        "enum": [
          "pr_link",
          "commit_sha",
          "test_output",
          "diff",
          "logs",
          "screenshot",
          "artifact_path",
          "api_response"
        ]
      },
      "description": "Optional list of evidence types the agent must return to prove work completion."
    },
    "parent_sha": {
      "type": "string",
      "pattern": "^[a-f0-9]{64}$",
      "description": "Optional context_sha of the parent packet this one was derived from. Enables lineage tracking."
    }
  }
}
